general,?,教育部思政司,教育部思想政治工作司关于“高校网络教育名师培育支持计划”遴选结果的公示,1,1438,?,?,人力资源部,?,2018-12-29,19:20
general,?,陕西省委办公厅,陕西工作交流第50期（壮大“三个经济”全面开放融合推动新时代追赶超越建设“三市”高质量发展）,2,99,?,?,校长办公室,?,2018-12-29,14:32
general,?,中共天水市委员会办公室,天水市委来校考察函,4,1323,?,?,校长办公室,创新港办公室,2018-12-29,14:26
general,教发厅函[2018]216号,教育部办公厅,教育部办公厅关于立即开展实验室安全检查的紧急通知,1,1432,?,?,实验室与资产管理处,?,2018-12-29,17:11
important,教党[2018]73号,教育部党组,中共教育部党组关于认真学习贯彻习近平总书记在庆祝改革开放40周年大会上重要讲话精神的通知,0,832,?,?,宣传部,?,2018-12-29,11:29
important,教人司[2018]461号,教育部人事司,关于推荐2019年中国科学院院士特别推荐候选人提名人选的通知,1,1427,?,2019-01-07,人力资源部,科研院,2018-12-29,11:09
general,?,教育部办公厅,教育部简报第59-66期,2,96,?,?,校长办公室,?,2018-12-29,11:22
general,陕发[2018]23号,陕西省委,中共陕西省委陕西省人民政府关于推动民营经济高质量发展的若干意见,0,834,?,?,?,?,2018-12-29,15:24
important,教技[2018]15号,教育部,教育部关于印发《高等学校乡村振兴科技创新行动计划（2018―2022年）》的通知,1,1434,?,?,科研院,?,2018-12-29,17:35
general,陕教工稳办[2018]1号,省委教育工委,关于近期校园安全管理的预警通知,0,837,?,?,保卫处,?,2018-12-29,18:00
general,陕教[2018]399,陕西省教育厅,关于表彰2018年陕西高等学校教学管理工作先进集体和先进个人的通报,1,1436,?,?,教师教学发展中心,?,2018-12-29,18:05
general,教育部简报[2018]第67期,教育部办公厅,教育部简报2018年第67期：南京航空航天大学精准推进思想政治工作着力培养堪当复兴大任的时代新人,2,100,?,?,宣传部,?,2018-12-29,19:17
general,陕办字[2018]112号,陕西省委办公厅,中共陕西省委办公厅陕西省人民政府办公厅关于表彰陕西省优秀民营企业和民营企业家的决定,0,835,?,?,?,?,2018-12-29,15:28
general,?,中国（陕西）自由贸易试验区工作办公室,中国（陕西）自由贸易试验区工作办公室关于采纳西安交通大学知识产权研究院研究成果的告知函,4,1322,?,?,社科处,法学院,2018-12-29,11:47
important,[2018]―25,中央办公厅,中共中央办公厅国务院办公厅转发《中央农办、农业农村部、国家发展改革委关于深入学习浙江”千村示范、万村整治“工程经验扎实推进农村人居环境整治工作的报告》的通知,0,833,?,?,校长办公室,?,2018-12-29,11:58
general,教政法厅函〔2018〕66号,教育部办公厅,教育部办公厅关于征求对《教育部2019年工作要点(征求意见稿)》意见的通知,1,1437,?,2019-01-04,校长办公室,?,2018-12-29,19:13
general,?,陕西省委办公厅,陕西工作交流第51期（双建双带双提升党建引领助脱贫）,2,97,?,?,扶贫办,?,2018-12-29,11:40
general,教高函〔2018〕18号,教育部,教育部关于增列中国人民大学、中山大学对口支援新疆大学的通知,1,1426,?,?,校长办公室,?,2018-12-28,15:42
general,?,陕西省委办公厅,陕西工作交流第52期（实施就业扶贫“五个到户到人”举措实现贫困劳动力稳定就业全覆盖）,2,95,?,?,扶贫办,?,2018-12-28,17:17
general,陕发[2018]21号,陕西省委,中共陕西省委陕西省人民政府关于印发《陕西省中长期青年发展规划（2018-2025年）》的通知,0,831,?,?,人力资源部,?,2018-12-28,17:13
general,?,华南理工大学,华南理工大学关于赴西安交通大学调研考察的函,4,1317,?,2019-01-11,校长办公室,?,2018-12-27,10:47
general,教高函〔2018〕17号,教育部国家卫生健康委,教育部国家卫生健康委关于公布首批国家临床教学培训示范中心认定结果的通知,1,1423,?,?,医学部,?,2018-12-27,17:42
important,教人司[2018]458号,教育部人事司,关于做好2019年领导干部报告个人有关事项工作的通知,1,1418,?,?,组织部,?,2018-12-27,16:59
general,中办发电[2018]45号,中央办公厅,中共中央办公厅国务院办公厅关于做好2019年元旦春节期间有关工作的通知,0,830,?,?,校长办公室,?,2018-12-27,17:48
general,教师[2018]21号,教育部,教育部关于批准2018年国家级教学成果奖获奖项目的决定,1,1422,?,?,教务处,?,2018-12-27,17:18
general,教党函[2018]117号,教育部党组,中共教育部党组关于征求对部党组及党组成员意见建议的通知,0,829,?,2019-01-14,校长办公室,?,2018-12-27,17:30
general,?,教育部,教育部党建工作领导小组办公室关于报送2018年下半年意识形态工作情况的通知,0,828,?,2019-01-16,宣传部,?,2018-12-27,17:26
general,?,山西省人民政府办公厅,邀请函,4,1318,2019-01-04,2018-12-28,校长办公室,?,2018-12-27,11:33
general,?,中国人民解放军陆军政治工作部,关于商请特邀专家为陆军院校建设提供咨询事,4,1319,?,2019-01-15,材料学院,机械学院,2018-12-27,11:38
general,陕纪教组发〔2018〕25号,陕西省纪委驻省教育厅纪检组,中共陕西省纪委驻省教育厅纪检组关于做好“三项专项”整治及“两节”期间贯彻落实中央八项规定精神的通知,0,827,?,?,纪委办公室,?,2018-12-27,10:56
general,?,陕西省教育厅,2018年11月《全省教育舆情日报》反馈情况（教育简报第34期）,2,93,?,?,宣传部,网络信息中心,2018-12-27,11:08
general,教技委[2018]10号,教育部科技司,教育部科技委关于公布2018年度“中国高等学校十大科技进展”入选项目的通知,1,1416,?,?,科研院,?,2018-12-26,10:33
general,陕教工组[2018]18号,省委教育工委,中共陕西省委教育工委关于做好2017年度省级和工委本级管理党费收支情况公示工作的通知,0,826,?,?,组织部,?,2018-12-26,18:44
general,教高厅[2018]4号,教育部办公厅,教育部办公厅关于印发《教育部高等学校教学指导委员会章程》的通知,1,1415,?,?,教务处,研究生院,2018-12-26,10:29
general,?,教育部巡视工作办公室,巡视工作人员鉴定表,4,1312,?,?,组织部,?,2018-12-25,17:54
general,?,教育部高等学校社会科学发展研究中心,第五届“高校党史教育论坛”征文通知,4,1310,?,?,社科处,马克思主义学院,2018-12-25,17:48
general,?,教育部,教育部简报54-58期,2,92,?,?,教务处,?,2018-12-25,11:59
important,组通字[2018]41号,中共中央组织部,中共中央组织部关于召开2018年度基层党组织组织生活会和开展民主评议党员几个问题的通知,0,824,?,?,组织部,?,2018-12-25,18:23
important,?,中共中央组织部,中共中央组织部关于认真做好领导干部报告个人有关事项工作的通知,0,825,?,?,组织部,?,2018-12-25,18:31
general,?,教育部巡视工作办公室,巡视工作人员鉴定表,4,1311,?,?,研究生院,?,2018-12-25,17:51
general,?,陕西省政法委,中共陕西省委政法委员会关于组建省扫黑除恶专项斗争法律专业人才库的通知,0,823,?,?,法学院,?,2018-12-25,18:12
general,?,西部机场集团有限公司,关于邀请出席西安-洛杉矶航线首航仪式的函,4,1314,2018-12-29,2018-12-27,?,?,2018-12-25,17:59
general,教办厅函〔2018〕108号,教育部,教育部办公厅关于第七届全国教育科学规划领导小组组成人员的通知,1,1411,?,?,校长办公室,?,2018-12-24,18:29
general,?,教育部,高校思想政治工作简报（2018年第60-62期）,2,91,?,?,宣传部,?,2018-12-21,15:36
general,陕融办发[2018]14号,中共陕西省委军民融合发展委员会,中共陕西省委军民融合发展委员会关于印发《陕西省军民融合企业孵化器认定和管理办法》的通知,0,815,?,?,科研院,?,2018-12-21,15:33
general,教人司[2018]453号,教育部,关于做好2018年直属高校领导班子和领导人员年度考核及干部选拔任用“一报告两评议”工作的通知,1,1406,?,2019-03-31,组织部,?,2018-12-21,11:54
general,陕发[2018]20号,省委办公厅,中共陕西省委关于印发《2018-2022年陕西省干部教育培训规划》的通知,0,820,?,?,组织部,?,2018-12-21,17:48
general,教高厅函[2018]82号,教育部,教育部办公厅关于提交高校教学实验室安全工作年度报告的通知,1,1407,?,2018-12-22,实验室与资产管理处,?,2018-12-21,12:00
general,陕办发[2018]39号,省委,中共陕西省委办公厅陕西省人民政府办公厅印发《关于实施“3+X”工程加快产业脱贫夯实乡村振兴基础的意见》的通知,0,818,?,?,扶贫办,?,2018-12-21,17:36
general,陕办字[2018]97号,省委,中共陕西省委办公厅陕西省人民政府办公厅关于印发《陕西省全面推行相对集中行政许可权改革工作方案》的通知,0,817,?,?,校长办公室,?,2018-12-21,17:30
general,陕纪教组发[2018]24号,中共陕西省纪委驻省教育厅纪检组,中共陕西省纪委驻省教育厅纪检组关于报送全省高校2018年党风廉政建设和反腐败工作总结的通知,0,821,?,2018-12-31,纪委办公室,?,2018-12-21,18:05
general,教人司[2018]274号,教育部人事司,关于举办2018年度直属高校及部省合建中西部高校党委组织部长专题培训班的通知,1,1408,?,2018-12-24,组织部,?,2018-12-21,15:39
general,陕办发[2018]38号,省委,中共陕西省委办公厅印发《关于加强和改进人民政协民主监督工作的实施意见》的通知,0,819,?,?,统战部,?,2018-12-21,17:39
general,?,中国科协,中国科协组织人事部关于邀请出席“接力精神火炬奋进新的长征”――弘扬新时代科学家精神座谈会的函,4,1306,2018-12-29,2018-12-24,?,?,2018-12-21,18:09
general,?,教育部,教育督导决策参考（2018年第13-14期）,0,816,?,?,党委政策研究室,?,2018-12-21,15:39
general,陕人社函【2018】948号,省委组织部,关于举办陕西省《院士大讲堂》活动的通知,0,814,?,?,继续教育学院,?,2018-12-21,09:27
general,?,陕西省委教育工委,中共陕西省委教育工委关于公布首批陕西高校党建工作示范高校、标杆院系、样板支部培育创建名单的通知,0,813,?,?,组织部,?,2018-12-20,18:23
general,陕教工[2018]3号,陕西省委教育工委,关于印发《陕西省全面落实研究生导师立德树人职责实施意见》的通知,0,810,?,?,人力资源部,研究生院,2018-12-20,17:35
general,?,江西省委教育工委,中共江西省委教育工委江西省教育厅感谢信,4,1303,?,?,科研院,校长办公室,2018-12-20,11:50
general,教技司[2018]483号,教育部科学技术司,教育部科技司关于高等学校开展基因编辑相关研究项目自查工作的通知,1,1402,?,2018-12-31,科研院,医学部,2018-12-20,10:54
general,教民厅函[2018]41号,教育部办公厅,教育部办公厅关于成立第二届全国民族教育专家委员会的通知,1,1405,?,?,统战部,?,2018-12-20,17:58
important,厅字[2018]137号,中共中央办公厅,中共中央办公厅关于印发《最高人民检察院职能配置、内设机构和人员编制规定》的通知,0,807,?,?,?,?,2018-12-20,11:59
general,?,陕西师范大学,中共陕西师范大学第十一次代表大会同贺邀请函,4,1302,?,2018-12-24,?,?,2018-12-20,11:41
important,中办发[2018]64号,中共中央办公厅,中共中央办公厅国务院办公厅印发《关于深化生态环境保护综合行政执法改革的指导意见》的通知,0,808,?,?,校长办公室,?,2018-12-20,12:10
important,中办发[2018]65号,中共中央办公厅,中共中央办公厅国务院办公厅印发《关于全面深入持久开展民族团结进步创建工作铸牢中华民族共同体意识的意见》的通知,0,809,?,?,统战部,?,2018-12-20,12:16
general,教改厅函[2018]11号,教育部办公厅,教育部办公厅关于自荐2018年重点工作“得意之作”和报送2019年度高校书记校长履职亮点项目的通知,1,1403,?,2018-12-29,校长办公室,?,2018-12-20,17:40
general,?,陕西省发展和改革委员会,关于原陕西省物价局停止收文的函,4,1304,?,?,?,?,2018-12-20,11:54
general,教思政厅函[2018]44号,教育部办公厅,教育部办公厅关于征集第26次全国高等学校党的建设工作会议经验交流材料的通知,1,1399,?,2018-12-28,组织部,宣传部,2018-12-19,17:28
general,教发厅函[2018]209号,教育部办公厅,教育部办公厅关于进一步做好教育系统今冬明春火灾防控工作的通知,1,1396,?,2018-12-25,保卫处,?,2018-12-18,16:39
general,?,教育部,教育舆情周报（2018年12月10日至12月16日）,2,89,?,?,宣传部,网络信息中心,2018-12-18,11:55
general,组通字[2018]38号,中共中央纪委机关中共中央组织部,中共中央纪委机关中共中央组织部关于认真开好2018年度县以上党和国家机关党员领导干部民主生活会的通知,0,804,?,2019-02-01,组织部,?,2018-12-18,17:40
important,厅字[2018]134号,中共中央办公厅,中共中央办公厅关于印发《党组讨论和决定党员处分事项工作程序规定（试行）》的通知,0,805,?,?,纪委办公室,组织部,2018-12-18,17:47
general,陕宣发[2018]38号,陕西省委宣传部,中共陕西省委宣传部关于命名西安交通大学网络化系统工程团队延安市宝塔区消防中队为“三秦楷模”的决定,0,803,?,?,宣传部,?,2018-12-18,17:32
general,?,教育部办公厅,教育部简报（第51-53期）,2,90,?,?,教务处,研究生院,2018-12-18,16:52
general,陕政办函[2018]333号,陕西省人民政府办公厅,陕西省人民政府办公厅关于做好2019年寒假大学生到政府机关见习工作的通知,1,1393,?,2018-12-20,校团委,?,2018-12-18,14:40
general,组电明字[2018]15号,中共中央组织部办公厅,中共中央组织部办公厅关于严格做好党员徽章制作、佩戴和管理工作的通知,0,800,?,?,组织部,?,2018-12-17,18:49
general,教技厅函【2018】133号,教育部办公厅,教育部办公厅关于公布2018年度教育部工程研究中心评估结果的通知,1,1387,?,?,科研院,?,2018-12-17,18:18
general,陕教工组【2018】15号,省委教育工委,中共陕西省委教育工委关于报送深刻汲取近年来高校系统违纪案件教训开展“以案促改”工作整改清单的通知,0,801,?,2018-12-19,纪委办公室,?,2018-12-17,19:34
general,?,教育部,教育部关于成立第二届高等学校科学研究优秀成果奖（科学技术）奖励委员会的通知,1,1384,?,?,科研院,?,2018-12-14,18:21
general,教人司【2018】446号,教育部人事司,教育部人事司关于贯彻落实《国务院办公厅转发人力资源社会保障部财政部关于调整机关事业单位工作人员基本工资标准和增加机关事业单位离休人员离休费三个实施方案的通知》的通知,1,1382,?,2018-12-31,人力资源部,?,2018-12-14,15:28
general,?,中共中央宣传部,关于诚请协调提供培训信息及资源的函,0,794,?,2018-12-20,组织部,宣传部,2018-12-14,10:52
general,?,教育部办公厅,教育部办公厅关于组织干部师生收听收看庆祝改革开放40周年大会的通知,1,1383,?,2018-12-18,宣传部,?,2018-12-14,18:12
important,中办发【2018】60号,中共中央办公厅,中共中央办公厅关于印发《干部人事档案工作条例》的通知,0,788,?,?,组织部,人力资源部,2018-12-14,20:47
important,中办发【2018】61号,中共中央办公厅,中共中央办公厅国务院办公厅印发《关于深化农业综合行政执法改革指导意见》的通知,0,789,?,?,?,?,2018-12-14,20:47
important,中办发【2018】63号,中共中央办公厅,中共中央办公厅国务院办公厅印发《关于深交通运输综合行政执法改革的指导意见》的通知,0,790,?,?,?,?,2018-12-14,22:18
important,中发[2018]3143号,中共中央办公厅,中共中央国务院关于建立更加有效的区域协调发展新机制的意见,0,787,?,?,?,?,2018-12-14,21:59
general,?,中共中央组织部办公厅,中共中央组织部办公厅关于召开全国干部人事档案工作会议的通知,0,793,2018-12-17,2018-12-14,?,?,2018-12-14,10:25
important,中办发【2018】62号,中共中央办公厅,中共中央办公厅国务院办公厅印发《关于深化市场监管综合行政执法改革的指导意见》的通知,0,791,?,?,?,?,2018-12-14,22:11
general,陕教新媒【2018】6号,陕西省教育新媒体研究院,关于公布2018年度陕西教育新媒体运营优秀单位的通知,4,1296,?,?,宣传部,?,2018-12-14,18:34
general,市政办函【2018】314号,西安市人民政府办公厅,西安市人民政府办公厅关于西安交通大学请求支持两个科学装置项目的复函,1,1378,?,?,科研院,?,2018-12-13,17:26
general,?,教育部科技发展中心,2018年高校实验室安全现场检查发现问题整改通知书,4,1292,?,2019-01-13,实验室与资产管理处,?,2018-12-13,15:38
general,?,教育部财务司,关于上交2018年教育部所属企业国有资本收益的通知,1,1379,?,?,资产公司,?,2018-12-13,17:31
general,?,陕西省委教育工委办公室,高校纪检工作（第四期）,0,791,?,?,纪委办公室,?,2018-12-13,17:58
general,?,教育部办公厅,教育部简报第46期、48-50期,2,86,?,?,?,?,2018-12-12,10:49
general,教思政厅函【2018】43号,教育部办公厅,教育部办公厅关于公布首批全国党建工作示范高校、标杆院系、样板支部培育创建单位名单的通知,1,1376,?,?,组织部,?,2018-12-12,10:37
general,教办厅函【2018】103号,教育部办公厅,教育部办公厅关于做好2018卷《中国教育年鉴》撰稿工作的通知,1,1377,?,2019-01-31,党委办公室,?,2018-12-12,18:28
general,陕教工组【2018】14号,陕西省委教育工委,中共陕西省委教育工委印发《关于在全省高校处级以上领导人员中开展“讲政治、敢担当、改作风”专题教育的实施方案》的通知,0,787,?,2019-03-01,组织部,?,2018-12-12,18:31
general,陕办通报[2018]第56期,陕西省委办公厅,胡和平同志在全省“讲政治、敢担当、改作风”专题教育动员视频会议上的讲话,0,785,?,?,组织部,宣传部,2018-12-11,18:11
general,组通字【2018】37号,中央组织部,中共中央组织部关于印发《2018―2022年全国组工干部教育培训规划》的通知,0,784,?,?,组织部,?,2018-12-11,10:26
general,组厅函字【2018】363号,中央组织部,中共中央组织部办公厅关于征求对《中国共产党党员教育管理工作条例》稿意见的通知,0,783,?,2018-12-17,组织部,?,2018-12-11,10:23
general,组厅函字【2018】357号,中央组织部,中共中央组织部办公厅关于报送2018年人才工作总结和2019年人才工作计划的通知,0,782,?,2018-12-14,组织部,人力资源部,2018-12-11,10:20
general,?,陕西省教育厅办公室,关于进一步做好软件正版化工作的通知,1,1371,?,2018-12-31,网络信息中心,?,2018-12-10,16:57
general,?,教育部,教育舆情周报（2018年12月3日至12月9日）,2,85,?,?,宣传部,网络信息中心,2018-12-10,17:30
general,教人司【2018】433号,教育部人事司,关于填报2018年度机构编制统计报表的通知,1,1372,?,2019-01-11,人力资源部,?,2018-12-10,17:11
general,陕办通报[2018]第55期,陕西省委办公厅,胡和平同志在陕西省“12.4”国家宪法日暨深入学习宣传和贯彻实施宪法座谈会上的讲话,0,779,?,?,教务处,?,2018-12-10,09:51
general,?,中国药科大学,讣告,4,1288,2018-12-15,2018-12-15,校长办公室,?,2018-12-10,15:44
general,陕组通字[2018]119号,陕西省委组织部,中共陕西省委组织部关于成立省委“讲政治、敢担当、改作风”专题教育领导小组办公室的通知,0,780,?,?,?,?,2018-12-10,09:55
general,?,省委,陕西工作交流第49期,2,84,?,?,?,?,2018-12-07,14:41
general,干教函字[2018]126号,中组部中宣部等,关于举办中国干部网络学院“新时代必须坚持新发展理念”“脱贫攻坚”等8期网上专题班的通知,0,776,?,?,组织部,?,2018-12-07,14:43
general,?,教育部巡视办,关于开展教育部直属高校巡查工作情况摸底统计的通知,0,778,2018-12-14,?,纪委办公室,?,2018-12-07,16:59
general,陕发[2018]17号,省委,中共陕西省委陕西省人民政府印发《关于营造企业家健康成长环境弘扬优秀企业家精神更好发挥企业家作用的实施意见》的通知,0,775,?,?,资产公司,?,2018-12-07,14:39
general,?,教育部,教育部办公厅关于召开全国师德师风建设工作视频会议的通知,1,1362,2018-12-14,2018-12-10,人力资源部,?,2018-12-06,15:45
general,?,中共党史人物研究会,关于商请担任中国中共党史人物研究会职务的函,4,1284,?,2018-12-20,社科处,马克思主义学院,2018-12-06,08:57
general,陕教工稳〔2018〕3号,省委教育工委,关于进一步加强高校安全管理工作的通知,1,1359,?,?,实验室与资产管理处,?,2018-12-06,10:18
general,教高函〔2018〕11号,教育部,教育部关于成立2018―2022年教育部高等学校教学指导委员会的通知,1,1358,?,?,教务处,?,2018-12-05,18:03
general,陕办通报[2018]第53期,省委,胡和平刘国中同志在全省秦岭生态环境保护大会上的讲话,0,774,?,?,?,?,2018-12-05,18:01
general,?,教育部,教育舆情周报（2018年11月26日至12月2日）,1,1350,?,?,宣传部,?,2018-12-04,16:39
general,?,西咸新区,陕西省西咸新区开发建设管理委员会关于与贵校合作办好陕西沣东新城医院的函,4,1279,?,?,医学部,?,2018-12-04,16:29
general,?,省政府,魏增军副省长关于西安交通大学退休教工信件的批示,1,1351,?,?,离退处,?,2018-12-04,16:23
general,陕教工〔2018〕2号,省委教育工委,关于启用中共陕西省委教育工作委员会新印章的通知,0,771,?,?,?,?,2018-12-04,11:42
general,?,中国建设银行陕西分行,关于邀请出席“建行大学”发布会的函,4,1280,2018-12-17,?,实验室与资产管理处,科教院,2018-12-04,16:31
important,组厅字[2018]47号,中组部,中共中央组织部办公厅关于组织部部务会成员变动情况的通报,0,770,?,?,组织部,?,2018-12-03,16:21
general,?,教育部党组,中共教育部党组关于何秀超、许涛同志免职的通知,0,766,?,?,校长办公室,?,2018-12-03,09:46
general,?,省委,陕西工作交流第47-48期,2,83,?,?,校长办公室,?,2018-12-03,16:22
general,?,教育部,教育部简报第40-45、47期,2,82,?,?,校长办公室,?,2018-12-03,11:26
general,教党任〔2018〕269号,教育部,中共教育部党组关于田祖荫、刘锦同志任职的通知,0,765,?,?,校长办公室,?,2018-12-03,09:53
general,?,教育部,教育部科技司关于组织开展2019年度国家科学技术奖教育部提名工作的通知,1,1347,?,?,科研院,?,2018-12-03,17:53
general,?,陕西省自然资源厅,陕西省自然资源厅转发《自然资源部关于印发自然资源科技创新发展规划纲要的通知》的通知,4,1277,?,?,科研院,?,2018-11-30,17:51
important,教党函〔2018〕107号,教育部党组,中共教育部党组关于做好2018年度高校党组织书记抓基层党建述职评议考核工作的通知,0,761,?,?,组织部,?,2018-11-30,16:46
general,教体艺厅函〔2018〕85号,教育部,教育部办公厅关于公布第一批全国普通高校中华优秀传统文化传承基地名单的通知,1,1342,?,?,校团委,?,2018-11-30,16:37
general,陕政研发[2018]6号,省委政策研究室,中共陕西省委政策研究室陕西省人民政府研究室关于表彰2017年度全省党政领导干部优秀调研成果的通报,0,768,?,?,党委政策研究室,?,2018-11-30,17:46
general,陕政法办函[2018]12号,陕西省委政法委,关于原省综治办、省委维稳办、省委610办停止收文的通知,0,756,?,?,保卫处,?,2018-11-29,16:08
general,?,西安市教育局,对接函,4,1274,?,?,校长办公室,?,2018-11-29,16:09
general,?,教育部,教育部办公厅关于商请确认第二届高等学校科学研究优秀成果奖（科学技术）奖励委员会委员的函,1,1335,?,2018-12-03,科研院,?,2018-11-29,07:54
general,陕办通报[2018]第52期,省委,胡和平同志在全省人大系统深入学习贯彻习近平总书记关于坚持和完善人民代表大会制度的重要思想交流会上的讲话,0,759,?,?,统战部,?,2018-11-29,16:13
general,陕办通报[2018]第49期,省委,胡和平同志在与省委和省级国家机关机构改革主要负责同志集体谈话会上的讲话,0,757,?,?,组织部,?,2018-11-29,16:11
general,陕办通报[2018]第51期,省委,胡和平牛一兵同志在全省宣传思想工作会议上的讲话,0,758,?,?,宣传部,?,2018-11-29,16:12
general,?,离退处,西安市民政局来校落实居家养老有关工作的情况报告,3,230,?,?,离退处,?,2018-11-28,16:55
general,教技厅〔2018〕5号,教育部,教育部办公厅关于进一步落实优化科研管理提升科研绩效若干措施的通知,1,1333,?,?,科研院,?,2018-11-28,08:20
general,?,海南大学,海南大学六十周年校庆邀请函,4,1273,2018-12-16,?,校长办公室,?,2018-11-28,16:54
general,?,广西大学,邀请函,4,1265,2018-12-08,?,校长办公室,?,2018-11-27,09:19
general,?,教育部,关于开展高校思想政治工作中青年骨干队伍建设项目答辩工作的通知,1,1330,?,?,学生工作部,?,2018-11-27,15:27
general,?,教育部,教育舆情周报（2018年11月19日至11月25日）,2,81,?,?,宣传部,?,2018-11-27,15:58
general,?,教育部,关于开展高校思想政治工作队伍培训研修中心答辩工作的通知,1,1331,?,?,马克思主义学院,?,2018-11-27,15:30
