general,?,省教育厅,关于表彰2019丝绸之路教育合作交流会承办工作先进单位、先进集体和优秀个人的通报,1,1103,?,?,国际处,?,2019-09-04,17:06
general,?,中国国际人才交流中心,关于征集俄罗斯开放式创新论坛合作交流信息的函,1,1101,?,?,国际处,?,2019-09-04,15:30
important,教党函_2019_90号,中共教育部党组,中共教育部党组关于印发《“新时代高校思想政治理论课创优行动”工作方案》的通知,0,649,?,?,马克思主义学院,?,2019-09-04,09:59
general,?,省委教育工委,关于认真组织好《新中国发展面对面》学习宣传工作的通知,0,652,?,?,宣传部,?,2019-09-04,17:07
general,?,教育部,教育部办公厅关于做好“小我融入大我青春献给祖国”主题社会实践活动优秀成果总结宣传推广工作的通知,1,1094,?,?,校团委,?,2019-09-03,16:23
general,?,省教育厅,关于开展党内法规研究机构摸底工作的通知,0,647,?,2019-09-05,组织部,?,2019-09-03,16:29
general,?,陕西省西咸新区沣西新城管委会,陕西省西咸新区沣西新城管委会专题会议纪要[2019]37号,4,503,?,?,创新港办公室,?,2019-09-03,15:48
general,?,教育部,教育部思想政治工作司关于启动2020年度高校思想政治工作有关培育建设项目申报工作的通知,1,1088,?,2019-09-30,社科处,?,2019-09-03,10:07
general,?,华润公司,关于对西安交通大学无偿为海原华润希望小镇项目提供规划设计的感谢信,4,504,?,?,人居学院,?,2019-09-03,15:52
general,?,西安高新区管委会,2019欧亚经济论坛科技分会邀请函,4,502,?,?,科研院,?,2019-09-03,15:47
general,?,省委教育工委,关于做好2018年度中央、省级和工委本级管理党费收支情况公示工作的通知,0,648,?,2019-09-11,组织部,?,2019-09-03,18:55
general,陕教工[2019]66号,省委教育工委,关于印发《陕西省高等学校实行党委领导下的校长负责制实施细则》《陕西省高等学校院系级党组织工作规程》《关于加强和改进高校党支部建设的意见》,0,644,?,?,党委办公室,?,2019-09-02,15:02
general,?,陕西省民族宗教委,关于参加国庆观礼的通知,0,645,?,?,学生工作部,?,2019-09-02,15:57
general,教办发[2019]15号,中央主题教育办,中央“不忘初心、牢记使命”主题教育领导小组办公室国家档案局关于做好“不忘初心、牢记使命”主题教育文件材料收集归档工作的通知,0,646,?,?,组织部,?,2019-09-02,17:22
general,教技厅函[2019]68号,教育部,教育部办公厅关于批复开展“基于绩效、诚信和能力的科研管理改革试点”中“稳定支持科研经费中提取奖励经费试点”工作的通知,1,1076,?,?,科研院,?,2019-09-02,15:51
general,?,杭州西湖国际博览会,关于邀请西安交通大学支持第二十一届中国杭州西湖国家博览会有关事项的函,4,498,?,?,科研院,?,2019-09-02,17:16
general,科协发学字[2019]38号,中国科协等,中国科协中宣部教育部科技部关于深化改革培育世界一流科技期刊的意见,1,1082,?,?,期刊中心,?,2019-09-02,17:18
general,?,重庆大学,重庆大学90周年校庆邀请函,4,500,2019-10-12,?,?,?,2019-09-02,17:21
general,教技司[2019]222号,教育部科技司,教育部科技司关于做好2019年创新人才推进计划申报工作的通知,1,1083,?,2019-09-12,科研院,?,2019-09-02,17:19
general,?,省教育厅,关于做好教育教学先进典型宣传推广工作的通知,1,1079,?,?,教务处,?,2019-09-02,16:06
general,?,高教司,致张迈曾书记、王树国校长函,1,1077,?,?,教务处,?,2019-09-02,15:52
general,?,马克思主义学院,关于我校本科思政课开设方案的建议书,4,497,?,?,教务处,?,2019-09-01,17:47
important,中办发[2019]47号,中办,中共中央办公厅国务院办公厅印发《关于深化新时代学校思想政治理论课改革创新的若干意见》的通知,0,642,?,?,马克思主义学院,?,2019-08-31,17:01
general,?,人力资源部,邀请函,3,234,2019-09-06,2019-09-06,人力资源部,?,2019-08-31,16:58
general,?,省委组织部,陕组信息第12-13期,0,639,?,?,组织部,?,2019-08-31,16:57
important,中发[2019]32号,中办,中共中央国务院关于支持深圳建设中国特色社会主义先行示范区的意见,0,641,?,?,党委办公室,?,2019-08-31,17:00
important,中发[2019]31号,中办,中共中央关于印发《中国共产党机构编制工作条例》的通知,0,640,?,?,人力资源部,?,2019-08-31,16:59
general,?,省政协,关于商请推进陕西省人民政协理论研究会第二届理事会常务理事、理事提名人选的函,0,637,?,2019-09-05,统战部,?,2019-08-30,17:48
general,?,省委宣传部,关于做好陕西省思想政治工作专家库人选和特聘专家推荐工作的通知,0,638,?,2019-09-10,人力资源部,?,2019-08-30,17:54
general,?,中共西北工业大学,致谢函,4,493,?,?,校长办公室,?,2019-08-29,17:51
general,?,省教育厅,关于开展中外（港澳台）合作办学年度检查工作的通知,1,1067,?,?,国际处,?,2019-08-29,17:45
general,?,教育部,关于开展中央专项巡视整改落实情况自查自评的通知,0,634,?,2019-09-12,纪委办公室,?,2019-08-29,16:47
general,陕办通报[2019]第31期,省委,胡和平同志在贫困县县委书记脱贫攻坚工作座谈会上的讲话,0,633,?,?,校长办公室,?,2019-08-28,11:14
general,?,陕西省气象局,陕西省气象局关于邀请参加2019欧亚经济论坛气象分会的函,4,491,?,2019-09-10,社科处,?,2019-08-28,11:12
general,?,教育部,关于赴你校开展港澳台学生工作调研的函,1,1061,2019-09-03,?,国际处,?,2019-08-28,18:01
general,?,省委主题教育办,中共陕西省委“不忘初心、牢记使命”主题教育简报第45-47期,2,121,?,?,组织部,?,2019-08-28,11:11
general,陕教工办[2019]17号,省委教育工委,关于开展第二批新时代高校党建示范创建和质量创优工作的通知,1,1051,?,?,组织部,?,2019-08-27,16:08
general,陕办字[2019]104号,省委,中共陕西省委办公厅陕西省人民政府办公厅关于印发《陕西省团校改革方案》的通知,0,628,?,?,校团委,?,2019-08-27,17:04
general,?,教育部,教育部思想政治工作司关于举办2019年全国高校网络文化建设骨干专题培训班的通知,1,1050,?,2019-08-30,宣传部,?,2019-08-27,15:57
general,陕办通报[2019]第30期,省委,胡和平、卢建军同志在省直机关党的建设工作会议上的讲话,0,627,?,?,机关与直属党委,?,2019-08-27,17:02
general,?,教育部,关于转发《人力资源社会保障部财政部关于完善事业单位高层次人才工资分配激励机制的指导意见》的通知,1,1056,?,2019-09-30,人力资源部,?,2019-08-27,17:15
general,?,中央审计署,关于审计西安交通大学党委书记张迈曾同志和校长王树国同志任职期间经济责任履行情况的通知,4,490,?,?,财务处,?,2019-08-27,17:05
general,陕教工组办〔2019〕4号,省委教育工委,关于印发《2019-2022年全省教育系统干部教育培训行动计划》的通知,1,1052,?,?,组织部,?,2019-08-27,16:24
general,?,省委,胡和平书记对《关于第四届“丝绸之路青年学者论坛”开幕式活动安排的请示》的批示,0,629,?,?,人力资源部,?,2019-08-27,17:07
general,?,省委教育工委,2019年全省高校领导干部暑期读书班简报第5、6、7期,2,120,?,?,?,?,2019-08-26,18:00
general,?,教育部社科司,教育部社科司关于开展中美经贸摩擦形势与政策教育专题示范教学的通知,1,1046,?,2019-08-30,马克思主义学院,?,2019-08-26,17:56
general,?,省教育厅发展规划处,关于开展核实高校历史沿革信息工作的通知,1,1043,?,2019-08-28,档案馆、博物馆,?,2019-08-26,17:16
general,?,教育部思政司,关于征求对《关于加强高校党的政治建设的若干措施》意见的函,1,1044,?,2019-08-29,组织部,?,2019-08-26,17:34
general,水节约[2019]234号,水利部,水利部教育部国家机关事务管理局关于深入推进高校节约用水工作的通知,1,1045,?,?,后勤保障部,?,2019-08-26,17:41
general,?,省委主题教育办,中共陕西省委“不忘初心、牢记使命”主题教育简报第44期,2,117,?,?,组织部,?,2019-08-25,09:28
general,教高函〔2019〕14号,教育部,教育部关于2019―2021年基础学科拔尖学生培养基地建设工作的通知,1,1033,?,?,钱学森学（书）院,?,2019-08-23,16:36
general,?,省委组织部,陕组信息第10-11期,0,621,?,?,组织部,?,2019-08-23,08:11
general,陕教师办[2019]26号,省教育厅,关于组织开展教师宣誓活动的通知,1,1039,?,?,人力资源部,?,2019-08-23,18:25
general,?,省委,胡和平书记、刘国中省长、魏增军副省长关于西安交通大学要情专报（[2019]第9期）的批示,0,622,?,?,人居学院,?,2019-08-23,08:16
general,?,教育部,教育部科技司关于推荐科技盛典――CCTV2019年度科技创新人物候选人的通知,1,1024,?,2019-09-02,科研院,?,2019-08-23,08:37
general,?,人力资源部,关于邀请校领导出席第五届“丝绸之路青年学者秋季研讨会”开幕式的请示,3,228,2019-09-05,2019-09-05,人力资源部,?,2019-08-23,08:15
general,教高厅函〔2019〕43号,教育部,教育部办公厅关于2019年度基础学科拔尖学生培养基地建设工作的通知,1,1032,?,?,钱学森学（书）院,?,2019-08-23,16:36
general,?,中国器官移植发展基金会,第七届中国移植运动会暨中国器官捐献日活动邀请函,4,477,2019-09-07,?,医学部,?,2019-08-23,08:14
general,?,省教育厅,关于开展2019年“为教师亮灯”公益活动的通知,1,1037,2019-09-10,?,人力资源部,?,2019-08-23,18:23
general,?,教育部,教育部关于印发《前沿科学中心建设管理办法》的通知,1,1025,?,?,科研院,?,2019-08-23,08:39
general,陕教高办[2019]23号,省教育厅,关于公布第六届全国大学生工程训练综合能力竞赛陕西赛区竞赛暨第二届陕西省本科高校工程训练教师教学能力竞赛获奖名单的通知,1,1036,?,?,教务处,?,2019-08-23,18:21
general,?,省教育厅,关于进一步做好高校学生食堂有关工作的通知,1,1031,?,?,后勤保障部,?,2019-08-23,11:44
general,?,西安交通大学城市学院,西安交通大学城市学院关于邀请学校领导出席学院2019级新生开学典礼的请示,4,475,2019-08-26,?,?,?,2019-08-22,11:42
general,?,省教育厅,关于开展“双一流”建设中期自评工作的通知,1,1023,?,2019-09-15,学科规划与建设办公室,?,2019-08-21,17:39
general,教思政司函〔2019〕26号,教育部,教育部思想政治工作司中央网信办网络社会工作局关于举办第四届全国大学生网络文化节和全国高校网络教育优秀作品推选展示活动的通知,1,1021,?,?,宣传部,?,2019-08-21,16:54
general,?,省人大,关于推荐省人大监察司法工作咨询专家候选人的函,0,619,?,2019-09-30,社科处,?,2019-08-21,17:37
general,?,省委主题教育办,中共陕西省委“不忘初心、牢记使命”主题教育简报第43期,2,116,?,?,组织部,?,2019-08-20,17:02
general,?,教育部,教育舆情周报（2019年8月12日至8月18日）,2,113,?,?,宣传部,?,2019-08-20,15:25
general,教技厅函[2019]67号,教育部,教育部办公厅关于开展2019年高校国防科技保密管理专项检查的通知,1,1018,?,?,保密办,?,2019-08-20,17:00
important,陕教工[2019]64号,省委教育工委,关于表彰2017-2018年度陕西教育系统办公室工作先进集体和先进工作者的通报,0,615,?,?,校长办公室,?,2019-08-20,15:09
general,教育部简报2019年第17期,教育部,教育部简报2019年第17期：树立健康第一理念服务健康中国战略――教育系统扎实推进“师生健康中国健康”主题健康教育活动,2,114,?,?,医学部,?,2019-08-20,15:26
general,?,兰州理工大学,兰州理工大学推进“双一流”建设暨纪念建校100周年大会邀请函,4,472,?,2019-09-20,校长办公室,?,2019-08-20,17:04
general,?,省委主题教育办,中共陕西省委“不忘初心、牢记使命”主题教育简报（第41、42期）,2,112,?,?,组织部,?,2019-08-19,15:59
general,?,中国改革年鉴,《中国改革年鉴（2018卷）――深改五周年（2013-2017）》专卷介绍,4,469,?,?,宣传部,?,2019-08-19,16:01
general,?,教育部,关于转发《教育部等五部门关于完善安全事故处理机制维护学校教育教学秩序的意见》及征集有关案例的函,1,1015,?,2019-09-10,校长办公室,?,2019-08-19,17:12
general,?,省委宣传部,通知,0,613,?,?,宣传部,?,2019-08-19,16:00
general,教学函〔2019〕6号,教育部,教育部关于印发《2020年全国硕士研究生招生工作管理规定》的通知,1,1012,?,?,研究生院,?,2019-08-16,17:57
important,陕教工组办[2019]5号,陕西省委教育工委,关于在全省高校集中开展整顿软弱涣散基层党组织、加强教师党支部“双带头人”建设的通知,0,598,?,2019-08-25,组织部,?,2019-08-16,16:02
general,?,省委,胡和平书记、刘国中省长对要情专报（第8期）的批示,0,596,?,?,科研院,?,2019-08-15,18:11
general,?,省委办公厅,陕西工交流第21、22期,2,109,?,?,组织部,?,2019-08-15,18:15
general,教技函[2019]50号,教育部,教育部关于印发开展关键核心技术集成公关大平台建设相关文件的通知,1,1009,?,?,科研院,?,2019-08-15,18:18
general,?,省委主题教育办,中共陕西省委“不忘初心、牢记使命”主题教育简报（第40期）,2,110,?,?,组织部,?,2019-08-15,18:17
general,?,省委,胡和平书记对要情专报（第9期）的批示,0,597,?,?,科研院,?,2019-08-15,18:14
general,?,教育部新闻办,教育舆情周报（2019年8月5日至8月11日）,2,108,?,?,宣传部,网络信息中心,2019-08-14,17:34
general,国科发政[2019]260号,科技部,科技部等6部门印发《关于扩大高校和科研院所科研相关自主权的若干意见》的通知,1,1000,?,?,科研院,社科处,2019-08-13,16:05
general,?,陕西省人民政府,省政府关于共建西安交通大学医学部及其附属医院的请示的批复,1,1002,?,?,医学部,?,2019-08-13,18:07
general,?,省委主题教育办,中共陕西省委“不忘初心、牢记使命”主题教育简报（第38、39期）,2,107,?,?,组织部,?,2019-08-13,18:02
general,?,政协陕西省委办公厅,关于接待湖北省政协考察组来陕调研的函,0,583,?,2019-08-22,党委办公室,科研院,2019-08-12,16:28
general,?,教育部财务司,关于开展校企改革工作专项调研的通知,1,997,2019-08-15,2019-08-15,资产公司,财务处,2019-08-12,10:54
general,?,世界人工智能大会组委会办公室,2019世界人工智能大会开幕式邀请函,4,459,?,2019-08-28,科研院,?,2019-08-09,16:35
general,?,中国核动力研究设计院,中国核动力研究设计院《核动力工程》协办单位邀请函,4,461,?,?,科研院,?,2019-08-09,18:33
general,?,石河子大学,石河子大学校庆邀请函,4,457,2019-09-08,2019-08-20,校长办公室,?,2019-08-09,11:47
general,?,省委主题教育办,中共陕西省委“不忘初心、牢记使命”主题教育简报（第37期）--省委召开“不忘初心、牢记使命”主题教育领导小组会议,2,104,?,?,组织部,?,2019-08-08,17:07
general,?,陕西省委网信办,关于请提供北斗卫星导航系统建设和应用情况材料的函,0,581,?,2019-08-30,科研院,?,2019-08-08,17:03
general,?,南通市人民政府办公室,关于赴西安交通大学开展合作交流的函,1,993,?,2019-08-13,科研院,校长办公室,2019-08-08,17:30
general,?,陕西省教育厅,关于开展涉外法治人才培养情况调研的通知,1,994,?,2019-08-12,法学院,国际教育学院,2019-08-08,18:21
general,?,武汉大学,讣告,4,453,?,?,党委办公室,?,2019-08-07,11:20
important,教人司[2019]302号,教育部,关于对2019年中国科学院院士初步候选人材料进行公示的通知,1,990,?,2019-08-10,人力资源部,?,2019-08-07,20:09
general,?,江苏省科技厅,第七届中国江苏产学研合作大会邀请函,4,452,2019-11-04,?,科研院,?,2019-08-07,11:18
general,?,省政府,方光华专题听取医改和卫生健康工作汇报安排意见,1,987,2019-08-09,2019-08-08,医学部,?,2019-08-06,15:47
general,?,三亚市人民政府,邀请函,4,451,2019-08-22,?,科研院,?,2019-08-06,15:48
general,陕办字[2019]103号,省委,中共陕西省委办公厅陕西省人民政府办公厅关于印发《陕西省深入学习浙江“千万工程”经验扎实推进农村人居环境整治的实施意见》的通知,0,571,?,?,党委办公室,?,2019-08-06,15:46
general,?,管理学院,管理学院关于队伍建设发展思路的请示,3,222,?,?,人力资源部,?,2019-08-06,15:43
general,?,教育部,教育部科技司关于组织申报教育部工程研究中心建设项目的补充通知,1,981,?,2019-08-15,科研院,?,2019-08-05,08:16
general,?,省委教育工委,关于举办高校领导干部暑期读书班暨“不忘初心、牢记使命”主题教育动员部署会的预通知,0,565,2019-08-21,?,?,?,2019-08-05,15:58
general,陕教工〔2019〕35号,省委教育工委,关于印发《中共陕西省委教育工委、陕西省教育厅机关党员领导干部与高校党外代表人士联谊交友实施办法》的通知,1,983,?,?,统战部,?,2019-08-05,11:57
important,厅字[2019]39号,中办,中共中央办公厅国务院办公厅关于印发《天然林保护修复制度方案》的通知,0,569,?,?,党委办公室,?,2019-08-05,16:47
general,?,教育部,关于调研了解教师宣誓工作开展情况的函,1,986,?,2019-08-16,人力资源部,基础教育党委,2019-08-05,18:14
general,?,教育部,教育部办公厅征求对《教育部关于简政便民优化服务修改和废止部分规章的决定（征求意见稿）》《教育部证明事项保留清单（征求意见稿）》意见的通知,1,984,?,2019-08-15,校长办公室,?,2019-08-05,15:24
general,陕办通报[2019]第28期,省委,胡和平、刘国中同志在省委十三届五次全会上的讲话,0,572,?,?,党委办公室,?,2019-08-05,16:42
general,厅字[2019]39号,中办,中共中央办公厅国务院办公厅关于印发《党政主要领导干部和国有企事业单位主要领导人员经济责任审计规定》的通知,0,568,?,?,审计处,财务处,2019-08-05,16:45
general,?,省科技厅,关于征集重大科技成果宣传报道素材的函,1,980,?,?,科研院,?,2019-08-03,21:18
general,陕组通字[2019]102号,省委组织部,中共陕西省委组织部关于做好2019年秋季学期专题研讨班学员选调工作的通知,0,563,?,?,组织部,?,2019-08-02,16:12
general,教发司[2019]188号,教育部,关于2019-2020年节约型公共机构示范单位创建及公共机构能效领跑者自荐推荐工作的通知,1,979,?,2019-08-15,后勤保障部,?,2019-08-02,15:09
general,?,上海市教委,上海市教育委员会关于邀请出席2019年世界人工智能大会教育行业主题论坛的函,4,444,2019-08-29,2019-09-05,科研院,?,2019-08-02,15:59
general,教发厅函〔2019〕74号,教育部,教育部办公厅关于认真贯彻落实习近平总书记重要指示精神全力做好防汛抗洪和山洪滑坡泥石流灾害防御工作的紧急通知,1,976,?,?,保卫处,?,2019-08-02,15:03
general,陕组通字[2019]103号,省委组织部,中共陕西省委组织部关于做好2019年秋季学期专题研修工作的通知,0,564,?,?,组织部,?,2019-08-02,16:13
general,?,教育部,教育部科技司关于开展2018年度国际科技合作与交流统计调查和国际科技合作重点工作年度监测的通知,1,978,?,2019-08-15,科研院,?,2019-08-02,15:07
general,?,省委教育工委,关于报送2019年度统战工作实践创新成果的通知,0,561,?,?,统战部,?,2019-08-02,15:04
general,党教函字[2019]29号,中组部,关于举办党员教育管理专题培训班的函,0,562,2019-08-23,2019-08-09,组织部,?,2019-08-02,16:10
general,陕教工[2019]59号,省委教育工委,关于印发《中共陕西省委教育工委党务公开目录》的通知,0,558,?,?,党委办公室,?,2019-08-01,14:52
general,?,教育部,关于进一步充实教育部直属高校定点扶贫工作力量的函,1,974,?,?,扶贫办,?,2019-08-01,14:54
general,?,省委主题教育办,中共陕西省委“不忘初心、牢记使命”主题教育简报第35-36期,2,102,?,?,组织部,?,2019-08-01,15:47
general,?,西安市雁塔区教育局,关于西安交通大学附属中学航天学校2019年小学开学的函,4,439,?,?,社会教育管理处,?,2019-08-01,15:44
general,?,武汉大学,讣告,4,441,?,?,校长办公室,?,2019-08-01,18:08
general,?,教育部,关于开展中管高校巡察工作专题调研的函,0,560,?,2019-08-20,纪委办公室,?,2019-08-01,15:45
important,教思政厅函〔2019〕15号,教育部,教育部办公厅关于开展第二批新时代高校党建示范创建和质量创优工作的通知,1,970,?,?,组织部,?,2019-07-31,17:40
general,?,教育部,关于“中俄综合性大学校长圆桌论坛”有关事宜的通知,1,973,?,?,国际处,?,2019-07-31,18:20
general,?,浙江大学,讣告,4,433,?,2019-08-03,校长办公室,?,2019-07-31,09:50
general,?,陕西省戏剧家协会,关于举办庆祝建国70周年、纪念交大西迁63周年暨西安越剧团艺术团建团20周年庆典活动的函,4,434,?,?,宣传部,?,2019-07-31,09:51
general,?,施甸县委,关于赴西安交通大学考察对接相关工作的函,4,438,?,2019-08-03,扶贫办,?,2019-07-31,17:49
general,?,教育部,关于征集全国研究生教育大会主题展览素材的函,1,972,?,?,研究生院,?,2019-07-31,18:16
general,?,兰州大学,兰州大学建校110周年纪念活动邀请函,4,436,2019-09-17,?,校长办公室,?,2019-07-31,17:50
general,?,省委,陕西工作交流第18-20期,0,556,?,?,校长办公室,?,2019-07-31,17:51
general,?,省委,中共陕西省委“不忘初心、牢记使命”主题教育简报第31-34期,2,100,?,?,组织部,?,2019-07-30,16:27
general,?,省教育厅,关于做好2019年度陕西高等教育教学改革研究项目申报工作的通知,1,964,?,?,教务处,?,2019-07-30,11:32
general,?,教育部,教育舆情周报（2019年7月22日至7月28日）,1,967,?,?,宣传部,网络信息中心,2019-07-30,16:31
general,?,陕西省科技厅,关于商请推荐人员加入陕西秦岭实验室筹建工作推进组的函,1,966,?,2019-08-01,科研院,?,2019-07-30,16:26
general,?,省委主题教育办,中共陕西省委“不忘初心、牢记使命”主题教育简报第30期,2,99,?,?,组织部,?,2019-07-29,16:58
general,?,经金学院,关于中航材项目情况介绍及合作意向的请示,3,217,?,?,科研院,?,2019-07-29,17:01
general,?,教育部科技发展中心,关于举办2019年高校实验室EH&S管理交流培训会的通知,4,430,?,?,实验室与资产管理处,?,2019-07-29,17:44
general,陕教通报第13期,省委,董小龙同志在全省高校思政课教师“大练兵”创优行动表彰大会上的讲话,1,956,?,?,马克思主义学院,?,2019-07-26,09:52
general,?,省委教育工委,关于对落实“两个责任”和破除形式主义、官僚主义突出问题情况进行自查的通知,0,548,?,2019-09-10,纪委办公室,?,2019-07-25,16:13
general,?,教育部,教育部简报第2―16期,2,96,?,?,校长办公室,?,2019-07-25,16:23
general,?,教育部,教育部简报（特辑）2019年第11-30期,2,95,?,?,校长办公室,?,2019-07-24,16:18
general,?,第二届全国青少年运动会组委会,关于邀请高水平大学领导来晋参加第二届全国青年运动会开幕式相关活动的函,1,952,2019-08-08,?,校长办公室,?,2019-07-24,11:29
general,?,西咸新区消防救援支队沣西新城大队,小型消防站入驻交大创新港需解决事宜清单,4,425,?,?,保卫处,?,2019-07-24,09:25
general,?,教育部,关于征求对《教育系统内部审计工作规定（修订稿）（征求意见稿）》意见的函,1,953,?,2019-08-09,审计处,?,2019-07-24,15:26
general,?,中北大学,关于商请建立国家西部能源研究院太原分院（太原基地）的函,1,951,?,?,科研院,?,2019-07-24,11:28
general,陕办通报[2019]第27期,省委,胡和平同志在全省“不忘初心、牢记使命”主题教育工作座谈会上的讲话,0,545,?,?,组织部,?,2019-07-24,09:21
general,?,教育部,关于召开2019年直属高校人才工作座谈会的通知,1,947,2019-07-29,2019-07-25,?,?,2019-07-24,09:39
important,学位办[2019]15号,教育部,关于推荐国务院学位委员会第八届学科评议组成员人选的通知,1,945,?,2019-09-15,研究生院,?,2019-07-23,11:36
general,教社科司函[2019]105号,教育部,教育部社科司关于做好国家文化产业发展项目库申报工作的通知,1,944,?,2019-08-30,资产公司,?,2019-07-23,09:43
general,?,陕西省委不忘初初心牢记使命主题教育办,中共陕西省委“不忘初心、牢记使命”主题教育简报第28-29期,0,544,?,?,组织部,?,2019-07-23,14:59
general,?,教育部,教育舆情周报（2019年7月15日至7月21日）,1,946,?,?,宣传部,?,2019-07-23,11:41
general,教社科司函[2019]105号,教育部,教育部办公厅科技部办公厅关于开展2020年度“高等学校学科创新引智计划”项目申报工作的通知,1,942,?,2019-08-09,科研院,?,2019-07-23,09:42
general,?,云南省政府,感谢函,1,938,?,?,社科处,?,2019-07-22,17:14
general,?,省教育厅,关于梳理报送一带一路教育推进情况的通知,1,933,?,2019-07-25,国际处,?,2019-07-22,11:43
general,?,省委教育工委,关于认真落实中央和省委主题教育领导小组关于防范和制止借“不忘初心、牢记使命”主题教育搞不当营商活动的通知,0,538,?,?,组织部,?,2019-07-22,11:44
general,?,省委,中共陕西省委“不忘初心、牢记使命”主题教育简报第27期,2,93,?,?,组织部,?,2019-07-22,15:07
