important,教发厅函[2019]55号,教育部,教育部办公厅关于印发《教育部脱贫攻坚工作领导小组工作规则》和《教育部脱贫攻坚工作领导小组办公室工作制度》的通知,1,494,?,?,扶贫办,?,2019-04-22,17:14
general,?,科研院,关于请学校主要领导参加西安交通大学――航天科工二院战略合作协议仪式的请示,3,98,2019-04-30,?,科研院,?,2019-04-19,17:49
general,?,中组部,中共中央组织部办公厅关于颁布《全国组织系统信息资源核心元数据》等4项标准的通知,0,306,?,?,组织部,?,2019-04-19,17:43
important,教社科函〔2019〕10号,教育部,教育部关于印发《普通高等学校思想政治理论课教师队伍培养规划（2019―2023年）》的通知,1,480,?,?,马克思主义学院,?,2019-04-19,17:02
general,?,省教育厅,关于召开智慧教育创新发展会议的通知,1,476,2019-04-25,2019-04-22,教务处,?,2019-04-19,16:51
general,教育简报第9期,省教育厅,陕西省2019届高校毕业生精准帮扶专场招聘会暨“百万大学生留西安”就业创业招聘会媒体报道汇编,2,51,?,?,宣传部,?,2019-04-19,16:59
general,教社科函〔2019〕9号,教育部,教育部关于印发《普通高等学校马克思主义学院建设标准（2019年本）》的通知,1,481,?,?,马克思主义学院,?,2019-04-19,17:05
general,?,省委教育工委,关于参加习近平总书记关于加强和改进统一战线工作的重要思想研讨班的预通知,0,304,?,2019-05-08,统战部,?,2019-04-19,16:53
general,教育简报第10期,省委教育工委,2019年3月《全省教育舆情日报》反馈情况,2,50,?,?,宣传部,?,2019-04-19,16:55
general,教发厅函〔2019〕57号,教育部,教育部办公厅关于做好2019年学校防灾减灾救灾工作的通知,1,483,?,?,保卫处,校长办公室,2019-04-19,17:18
general,?,渭南师范学院,关于赴西安交通大学“西迁精神博物馆”参观学习的函,4,205,2019-04-23,2019-04-23,档案馆、博物馆,?,2019-04-18,09:38
general,组厅函字[2019]94号,中组部,中共中央组织部关于开展2019年组织工作选题统计分析的通知,0,302,?,?,组织部,?,2019-04-18,17:13
general,?,省委普法工作领导小组,关于商请在西安交通大学举办第四届陕西省高校法治文化节开幕式的函,0,300,2019-04-25,2019-04-24,学生工作部,?,2019-04-18,14:02
general,组厅字[2019]19号,中组部,中共中央组织部办公厅关于印发干部党性教育基地备案目录的通知,0,301,?,?,组织部,?,2019-04-18,17:12
general,?,江苏省人才工作领导小组,调研函,4,204,2019-04-25,2019-04-25,校长办公室,?,2019-04-18,09:39
general,?,附中,全国人大常委会副委员长、民进中央主席蔡达峰一行视察调研交大附中航天学校的情况汇报,3,86,?,?,交大附中,?,2019-04-18,18:24
general,?,省委教育工委,中共陕西省委教育工委办公室关于转发国家教育行政学院《组织开展2019上半年全国大学生入党积极分子、发展对象、预备党员和党员网络培训的通知》的通知,0,299,?,?,组织部,?,2019-04-18,11:15
general,?,教育部人事司,关于举办高校组织工作座谈会暨新时代加强高校领导班子和干部队伍建设系列课题研究部署会的通知,1,474,?,?,组织部,?,2019-04-18,09:04
general,陕教通报第5期,省教育厅,王建利同志在2019年度陕西省学位与研究生教育工作情况通报会上的讲话,1,472,?,?,研究生院,?,2019-04-18,16:20
general,?,教育部,教育部办公厅关于召开“六卓越一拔尖”计划2.0启动大会的通知,1,473,2019-04-28,2019-04-22,教务处,?,2019-04-18,18:48
general,?,教育部,教育舆情周报（2019年4月8日-4月14日）,1,463,?,?,宣传部,?,2019-04-17,16:22
general,?,太乙路街道办,关于加快燃气锅炉低氮改造工作的函,4,194,?,2019-06-30,后勤保障部,?,2019-04-17,15:14
general,?,省教育厅,通知（关于举办“我和我的祖国陕西学校行”系列活动的通知）,1,457,2019-04-18,2019-04-17,宣传部,?,2019-04-17,09:56
general,教财司函[2019]151号,教育部,关于印发《2019年教育财务工作要点》的通知,1,461,?,?,财务处,?,2019-04-17,15:58
general,陕办通报[2019]第13期,省委,胡和平同志在全省科技创新大会暨科学技术奖励大会上的讲话,0,296,?,?,科研院,?,2019-04-17,15:15
general,教人厅函〔2019〕15号,教育部,教育部办公厅关于开展2019年百千万人才工程国家级人选推荐工作的通知（3名）,1,448,?,?,人力资源部,?,2019-04-16,10:55
general,?,教育部,教育部科技司关于组织开展第二十一届中国专利奖推荐工作的通知,1,454,?,2019-05-01,科研院,?,2019-04-16,15:22
general,?,上海交通大学,讣告,4,192,?,?,校长办公室,?,2019-04-16,09:26
general,?,西北农林大学,第八届“西北联大与中国高等教育发展论坛”征稿并邀请函,4,193,?,?,医学部,?,2019-04-16,17:01
general,教发厅函〔2019〕53号,教育部,教育部办公厅关于做好高等学校消防安全工作的通知,1,451,?,?,保卫处,?,2019-04-16,11:42
general,?,教育部,关于提供审计资料的函,1,453,?,2019-04-19,科研院,?,2019-04-16,15:20
important,中办发[2019]24号,中办,中共中央办公厅国务院办公厅印发《关于促进中小企业健康发展的指导意见》的通知,0,294,?,?,校长办公室,?,2019-04-16,09:27
general,教技司[2019]126号,教育部,教育部科技司关于举办第十期高校科技工作专题培训班的通知,1,452,?,2019-04-22,校长办公室,?,2019-04-16,15:18
general,?,教育部,教育部办公厅关于召开2019年滇西脱贫攻坚部际联系会暨教育部直属系统扶贫工作推进会的通知,1,456,2019-04-22,2019-04-18,?,?,2019-04-16,17:54
general,?,教育部,教育部关于改进企业国有资产评估项目备案管理的通知,1,443,?,?,实验室与资产管理处,资产公司,2019-04-15,17:43
general,组厅字[2019]18号,中组部,关于举办党员管理处（组织处）处长培训班的通知,0,291,2019-04-28,2019-04-19,组织部,?,2019-04-15,17:02
general,?,省教育厅,关于开展消防安全大检查的紧急通知,1,439,?,?,保卫处,?,2019-04-15,16:07
important,教党函[2019]37号,中共教育部党组,中共教育部党组关于抓好赋予科研管理更大自主权有关文件贯彻落实工作的通知,0,292,?,?,科研院,?,2019-04-15,17:03
general,?,中国矿业大学（徐州）,中国矿业大学（徐州）110周年校庆邀请函,4,191,2019-05-31,?,校长办公室,?,2019-04-15,17:41
general,?,附中,全国人大常委会副委员长、民进中央主席蔡达峰一行视察交大附中航天学校的汇报,3,74,?,?,交大附中,?,2019-04-13,16:09
general,?,财政部教育部等,财政部教育部人力资源社会保证部退役军人部中央军委国防动员部关于印发《学生资助资金管理办法》的通知,1,436,?,?,学生工作部,?,2019-04-12,17:58
general,教社科厅函〔2019〕11号,教育部,教育部办公厅关于组织开展全国高校思想政治理论课建设优秀成果巡礼活动的通知,1,432,?,?,马克思主义学院,?,2019-04-12,14:51
general,教社科厅函〔2019〕12号,教育部,教育部办公厅关于开展全国高校优秀思想政治理论课示范课巡讲活动的通知,1,431,?,?,马克思主义学院,?,2019-04-12,14:49
general,陕教[2019]89号,省教育厅,关于西安交通大学等4所高校申请变更中外合作办学项目有关事项的批复,1,427,?,?,国际处,?,2019-04-12,11:45
general,教社科司函[2019]42号,教育部,教育部社科司关于转发《关于做好“庆祝新中国成立70周年”期刊主题宣传引导资助项目申报的通知》的通知,1,430,?,2019-04-16,期刊中心,宣传部,2019-04-12,14:13
general,?,省委网信办,关于选派干部到我办学习锻炼的函,0,290,?,2019-04-19,网络信息中心,?,2019-04-12,18:02
general,?,省委,陕西工作交流第6期,2,49,?,?,校长办公室,?,2019-04-12,14:15
general,?,省教育厅,关于推荐离退休干部做客陕西广播电视台“我和我的祖国”访谈工作的通知,1,433,?,?,离退处,?,2019-04-12,14:50
important,陕教工组[2019]42号,省委教育工委,中共陕西省委教育工委关于加强和改进高校领导干部深入基层联系学生工作的通知,0,286,?,?,学生工作部,?,2019-04-11,17:03
important,陕教[2019]82号,省教育厅,关于公布2018年度普通高等学校本科专业和2019年高职专业备案审批结果的通知,1,422,?,?,教务处,?,2019-04-11,17:02
general,?,省委政研室,关于召开创新人才队伍建设调研座谈会的函,0,285,2019-04-18,?,人力资源部,?,2019-04-11,11:51
general,?,省教育厅,关于做好高校实验室摸底调查工作的通知,1,425,?,?,实验室与资产管理处,?,2019-04-11,18:00
general,?,省教育厅,关于做好丝绸之路教育合作交流会筹备工作的通知,1,421,?,?,国际处,?,2019-04-11,11:39
general,?,教育部,课题委托函,0,287,?,2019-04-15,组织部,?,2019-04-11,17:36
general,?,南昌大学,关于南昌大学党委书记喻晓社书记一行赴贵校调研的函,4,183,?,?,校长办公室,?,2019-04-11,11:53
general,?,省委教育工委,中共陕西省委教育工委办公室关于举办形势与政策高端报告会的通知,0,284,2019-04-15,2019-04-12,宣传部,?,2019-04-11,11:46
general,陕办通报[2019]第12期,省委,胡和平同志在全省“讲政治、敢担当、改作风”专题教育推进会上的讲话,0,281,?,?,组织部,?,2019-04-10,18:03
general,教离退厅函〔2019〕1号,教育部,教育部办公厅关于举办教育部直属高校、直属单位加强和改进离退休干部工作专题培训班（第4期）的通知,1,415,?,?,离退处,?,2019-04-10,15:40
general,?,教育部,民族教育工作动态2018年第10期,4,181,?,?,学生工作部,?,2019-04-10,18:04
general,?,教育部,教育部教师工作司关于举办师德师风建设专题研修班的通知,1,416,?,2019-04-17,人力资源部,?,2019-04-10,15:45
general,?,国家教育行政学院,关于商请接待国家教育行政学院第56期高校中青年干部培训班部分学员赴贵校调研的函,4,180,2019-04-16,?,校长办公室,?,2019-04-10,10:54
general,?,中共陕西省委党史研究室,关于前往西安交通大学座谈交流的函,0,282,?,?,马克思主义学院,?,2019-04-10,09:17
general,?,教育部,教育部办公厅关于调整教育部网络安全和信息化领导小组组成人员的通知,1,417,?,?,网络信息中心,?,2019-04-10,15:47
general,?,教育部巡视办,会议通知,0,280,2019-04-17,2019-04-12,纪委办公室,?,2019-04-10,11:58
general,?,教育部,关于2019年高层次专家国情研修班学员选调工作的通知,1,429,?,?,人力资源部,?,2019-04-10,12:00
general,?,陕西省政府,刘国中省长关于西安交通大学要情专报（[2019]第4期）的批示,1,401,?,?,校长办公室,?,2019-04-09,15:51
general,?,陕西省应急管理厅,陕西省应急管理厅关于进行应急管理科技战略合作的函,4,177,?,2019-04-19,科研院,?,2019-04-09,15:50
general,陕教发办[2019]3号,省教育厅,关于做好新时期全省高校后勤管理工作的通知,1,403,?,?,后勤保障部,?,2019-04-09,18:29
general,?,中央统战部,统战工作第11-14期,0,275,?,?,统战部,?,2019-04-09,10:54
general,?,教育部,教育部办公厅关于做好扶贫项目和资金使用管理的通知,1,408,?,?,扶贫办,?,2019-04-09,18:39
general,?,教育部,教育舆情周报（2019年4月1日至4月7日）,2,47,?,?,宣传部,?,2019-04-09,19:00
general,?,教育部,关于开展中国科学院院士候选人审核把关工作的通知,1,414,?,?,人力资源部,?,2019-04-09,18:33
general,陕教[2019]81号,省教育厅,陕西省教育厅关于公布2019年度陕西高等学校人文社会科学研究优秀成果奖励结果的通知,1,402,?,?,社科处,?,2019-04-09,15:59
general,?,教育部,教育部办公厅关于实施一流本科专业建设“双万计划”的通知,1,396,?,?,教务处,?,2019-04-09,09:27
general,陕办函[2019]67号,省委教育工委,关于召开全省学习贯彻习近平总书记在学校思想政治理论课教师座谈会上重要讲话精神座谈会的通知,0,274,2019-04-11,2019-04-10,?,?,2019-04-08,17:07
general,?,省教育厅,关于举办庆祝新中国成立70周年“我和我的祖国陕西学校行”系列活动的通知,1,389,?,?,校团委,?,2019-04-08,14:37
general,教社科厅函〔2019〕10号,教育部,教育部办公厅关于开展全国高校思想政治理论课教师“周末理论大讲堂”活动的通知,1,392,?,?,马克思主义学院,?,2019-04-08,16:18
general,?,碑林区文化站,2019年汛前文物安全工作排查的通知,4,170,?,?,档案馆、博物馆,?,2019-04-08,19:15
general,?,山东科技大学,关于赴西安交通大学学习考察的函,4,166,2019-04-12,?,校长办公室,?,2019-04-04,15:06
general,陕纪教组发[2019]5号,省委教育工委,关于印发《省纪委监委第四监督检查室与省纪委驻省教育厅纪检组关于加强处级干部问题线索管理和研判制度》的通知,0,270,?,?,纪委办公室,?,2019-04-04,11:43
general,?,人力资源部,关于邀请校领导出席第五届“丝绸之路青年学者秋季研讨会”开幕式的请示,3,66,2019-04-11,?,人力资源部,?,2019-04-04,14:09
general,教社科司函〔2019〕44号,教育部,关于印发《教育部社会科学司2019年工作要点》的通知,1,380,?,?,社科处,?,2019-04-04,14:03
general,?,西安理工大学,西安理工大学70周年校庆邀请函,4,167,2019-05-01,?,校长办公室,?,2019-04-04,17:36
general,?,孔子学院总部,关于召开中西部地区美国孔子学院中方承办院校座谈会的通知,1,382,2019-04-16,2019-04-11,国际教育学院,?,2019-04-04,17:27
general,陕教通报第4期,省教育厅,董小龙王建利张虎成同志在全省推进新时代教师队伍建设改革工作视频会议上的讲话,1,386,?,?,人力资源部,?,2019-04-04,18:05
important,中办发[2019]21号,中办,中共中央办公厅关于《公务员职务与职级并行规定》的通知,0,265,?,?,人力资源部,?,2019-04-03,10:24
general,陕教工办[2019]8号,省委教育工委,关于省委教育工委、省教育厅领导分工的通知,1,371,?,?,校长办公室,?,2019-04-03,08:07
general,陕司通[2019]43号,省委普法领导小组等,关于充分发挥“七五”普法讲师团作用开展“法润三秦大讲堂”宣讲活动的通知,0,263,?,?,宣传部,?,2019-04-03,10:12
general,?,省教育厅,关于开展2019年中国高等教育国际化发展状况调查的通知,1,372,?,?,国际处,?,2019-04-03,08:08
general,陕教干培[2019]4号,省委教育工委,关于开展系列主题教育培训班的通知,0,268,?,?,组织部,?,2019-04-03,17:53
general,教体艺〔2019〕2号,教育部,教育部关于切实加强新时代高等学校美育工作的意见,1,376,?,?,教务处,?,2019-04-03,17:54
general,教政法函〔2019〕12号,教育部,教育部关于取消一批证明事项的通知,1,378,?,?,校长办公室,?,2019-04-03,17:57
general,?,省学位办,关于开展学位证明书规范办理工作落实情况检查的通知,1,375,?,?,研究生院,?,2019-04-03,17:53
important,中办发[2019]19号,中办,中共中央办公厅国务院办公厅印发《关于以2022年北京冬奥会为契机大力发展冰雪运动的意见》的通知,0,264,?,?,校长办公室,?,2019-04-03,10:23
general,?,省教育厅,转发教育部社科司关于开展全国高校马克思主义理论学科2018年度发展状况调研的通知,1,374,?,2019-04-15,马克思主义学院,?,2019-04-03,17:51
general,?,省教育厅,关于做好《陕西教育年鉴（2019卷）》编纂工作的通知,1,370,?,?,校长办公室,?,2019-04-02,16:58
general,?,省政府,关于召开陕西省科技创新大会暨科学技术奖励大会的通知,1,365,2019-04-09,2019-04-03,科研院,?,2019-04-02,11:49
general,教学厅〔2019〕3号,教育部,教育部办公厅关于做好2019年重点高校招收农村和贫困地区学生工作的通知,1,361,?,?,招生办公室,?,2019-04-02,08:09
general,?,教育部,教育舆情周报（2019年3月25日至3月31日）,1,363,?,?,宣传部,?,2019-04-02,08:14
general,?,省委,胡和平书记关于西安交通大学要情专报（[2019]第4期）的批示,0,261,?,?,校长办公室,?,2019-04-02,11:08
general,?,省委教育工委,关于省委领导赴高校调研校园安全稳定工作的预通知,0,269,?,?,校长办公室,?,2019-04-01,17:25
general,?,国务院扶贫办,关于开展2019年度学习习近平总书记关于扶贫工作的重要论述征文活动的函,1,358,?,2019-06-30,社科处,?,2019-04-01,17:41
general,陕教安办[2019]8号,陕西省教育厅,关于进一步加强学校安全隐患排查整改的紧急通知,1,350,?,?,保卫处,?,2019-03-29,17:14
general,?,省教育厅,关于做好2019年高校稳定安全预警防范和信息报送工作的通知,1,351,?,2019-04-12,校长办公室,?,2019-03-29,17:21
general,?,铜川市政府,贺信,4,155,?,?,人力资源部,?,2019-03-29,17:40
general,?,厦门大学,厦门大学关于附属翔安医院开业诚邀贺电、贺信、贺词的函,4,150,?,2019-04-06,校长办公室,?,2019-03-29,09:10
general,?,省政府,梁桂常务副省长关于西安交通大学决策建言（2019年第3期）的批示,1,354,?,?,社科处,?,2019-03-29,17:41
general,?,萍乡市科技局,产学研合作工作联系函,4,147,2019-04-02,?,科研院,?,2019-03-28,11:05
general,?,省教育厅,关于印发《2019年全省教育系统老干部工作要点》的通知,1,335,?,?,离退处,?,2019-03-28,10:35
general,教体艺厅函〔2019〕25号,教育部,教育部办公厅关于遴选首届全国高校健康教育教学指导委员会专家人选的通知,1,338,?,?,教务处,?,2019-03-28,16:33
general,教办厅〔2019〕4号,教育部,教育部办公厅关于2018年教育部政府信息公开工作年度报告的公告,1,340,?,?,党委办公室,?,2019-03-28,17:06
general,?,省教育厅,转发省委老干局关于在全省离休干部中开展“六连六送六必看”活动的通知,1,331,?,?,离退处,?,2019-03-28,09:27
general,?,省委教育工委,省委教育工委召开2019年全省高校统战部长会议暨统战系统形势报告会,1,334,?,?,统战部,?,2019-03-28,10:33
general,教技厅函〔2019〕37号,教育部,教育部办公厅关于做好2019年度高等学校科研实验室安全工作的通知,1,320,?,?,实验室与资产管理处,科研院,2019-03-27,09:36
general,?,教育部,教育部科技司转发科技部中央宣传部中国科协关于举办2019年全国科技活动周的通知,1,317,?,2019-03-29,科研院,?,2019-03-27,08:06
general,?,教育部,关于举办“国企领导上讲台及国企骨干担任校外辅导员”启动仪式暨首场报告会的通知,1,318,2019-04-02,2019-03-29,学生工作部,?,2019-03-27,08:44
general,教高函〔2019〕7号,教育部,教育部关于公布2018年度普通高等学校本科专业备案和审批结果的通知,1,323,?,?,?,?,2019-03-27,11:32
general,陕教政办[2019]1号,省教育厅,关于做好2019年调查研究工作的通知,1,324,?,?,党委政策研究室,?,2019-03-27,11:55
general,教高函〔2019〕7号,教育部,教育部关于公布2018年度普通高等学校本科专业备案和审批结果的通知,1,327,?,?,教务处,?,2019-03-27,17:50
general,?,教育部,关于派员参加“双一流”建设高校海外培训班的通知,1,325,?,2019-04-15,国际处,?,2019-03-27,17:45
general,?,教育部,教育舆情周报（2019年3月18日至3月24日）,2,45,?,?,学生工作部,?,2019-03-26,16:25
important,中办发[2019]16号,中办,中共中央办公厅关于解决形式主义突出问题为基层减负的通知,0,246,?,?,党委办公室,?,2019-03-26,15:38
important,中发[2019]7号,中办,中共中央印发《关于加强和改进中央和国家机关党的建设的意见》的通知,0,247,?,?,组织部,?,2019-03-26,15:40
general,陕组通字[2019]67号,省委组织部,中共省委组织部关于印发《2019-2022年全省组工干部教育培训行动计划》的通知,0,251,?,?,组织部,?,2019-03-26,17:16
general,?,省委高教工委,中共陕西省委教育工委办公室关于做好2019年上半年党费工作有关事项的通知,0,245,?,?,组织部,?,2019-03-26,13:57
general,?,省教育厅,关于召开全省推进新时代教师队伍建设改革工作视频会议的通知,1,315,2019-03-28,2019-03-26,人力资源部,?,2019-03-26,16:46
important,厅字[2019]20号,中办,中共中央办公厅国务院办公厅印发《关于加强专门学校建设和专门教育工作的意见》的通知,0,248,?,?,学生处,?,2019-03-26,15:41
general,?,教育部,高校书记校长履职亮点项目实施方案反馈意见,1,304,?,?,校长办公室,?,2019-03-26,07:54
general,?,保山市扶贫办,关于商请西安交通大学给予有关事项帮扶的函,4,144,?,?,扶贫办,?,2019-03-26,10:48
general,?,教育部,教育部高等教育司关于报送“六卓越一拔尖”计划2.0启动大会专题展览素材的通知,1,307,?,2019-04-02,钱学森学（书）院,?,2019-03-26,11:42
important,中发[2019]8号,中办,中共中央印发《党政领导干部选拔任用工作条例》的通知,0,249,?,?,组织部,?,2019-03-26,15:42
general,教人厅函〔2019〕5号,教育部,教育部办公厅关于印发《2019年教育部干部培训班次计划》的通知,1,297,?,?,组织部,?,2019-03-25,11:41
important,教育部通报第8期,教育部,教育部党组书记、部长陈宝生在教育部网络安全和信息化领导小组第五次会议上的讲话,1,300,?,?,网络信息中心,?,2019-03-25,17:56
general,?,新闻学院,“新媒体学科融合与卓越新闻人才培养高峰论坛”邀请函,3,59,2019-04-06,?,人文学院,?,2019-03-25,14:21
important,教党函〔2019〕34号,中共教育部党组,中共教育部党组关于加强和改进高校领导干部深入基层联系学生工作的通知,0,242,?,?,学生工作部,?,2019-03-25,16:45
general,教人司[2019]88号,教育部,教育部人事司关于印发2019年工作要点的通知,1,301,?,?,组织部,?,2019-03-25,17:57
general,中组发[2019]5号,中组部中宣部,中共中央组织部中共中央宣传部关于认真学习贯彻习近平总书记为第五批全国干部学习培训教材所作《序言》精神的通知,0,243,?,?,组织部,?,2019-03-25,17:50
general,教思政司函〔2019〕14号,教育部,教育部思想政治工作司关于举办全国高校宣传部长培训班的通知,1,296,2019-04-08,2019-03-28,宣传部,?,2019-03-25,11:38
general,干教函字[2019]30号,中组部,关于做好第五批全国干部学习培训教材学习使用有关事项的通知,0,244,?,?,组织部,?,2019-03-25,17:51
general,?,省政府,刘国中省长对《关于“中国西部海外博士后创新示范中心”情况的报告》的批示,1,275,?,?,校长办公室,?,2019-03-22,09:40
general,?,山西大学,关于赴西安交通大学考察调研的函,4,135,?,?,校长办公室,?,2019-03-22,09:41
general,陕办字[2019]54号,省委,中共陕西省委办公厅关于成立陕西省高校网络文明建设领导小组的通知,0,240,?,?,宣传部,?,2019-03-22,09:42
general,?,教育部,关于举办高校干部工作专题培训班第一期的通知,1,277,2019-03-26,2019-03-22,组织部,?,2019-03-22,10:41
general,?,最高法,邀请函,1,281,2019-03-27,2019-03-25,法学院,?,2019-03-22,14:48
general,陕教工稳[2019]3号,省委教育工委,关于授予西安电子科技大学等7所高校2018年陕西省“平安校园”称号的决定,0,238,?,?,保卫处,?,2019-03-22,09:39
important,教育部通报第5期,教育部,教育部党组书记、部长陈宝生在教育部直属高校工作咨询委员会第二十八次全体会议暨全国高等教育工作会议上的讲话,0,241,?,?,校长办公室,?,2019-03-22,11:44
general,教基厅[2019]1号,教育部,教育部办公厅关于做好2019年普通中小学招生入学工作的通知,1,279,?,?,社会教育管理处,?,2019-03-22,11:42
general,陕教工办[2019]6号,省委教育工委,关于调整教育脱贫办公室组织机构的通知,1,271,?,?,扶贫办,?,2019-03-21,17:23
general,?,基金会,关于加强基金会建设的建议,3,54,?,?,交大基金会,?,2019-03-21,09:38
general,?,北京市岳成律师事务所,律师函,4,129,?,?,医学部,?,2019-03-21,15:59
general,?,党校/干部培训基地,党校/干部培训基地办公室近期工作汇报,3,52,?,?,组织部,?,2019-03-21,09:32
general,教社科司函〔2019〕36号,教育部社科司,教育部社科司关于申报2019年“中国特色哲学社会科学名作出版专项”的通知,1,272,?,?,资产公司,?,2019-03-21,19:02
general,?,陕西省国资委,关于商请明确陕西高级经济学院领导班子的函,4,133,?,?,组织部,?,2019-03-21,19:06
general,教高函〔2019〕6号,教育部,教育部关于公布2018年度国家虚拟仿真实验教学项目认定结果的通知,1,255,?,?,教务处,?,2019-03-20,11:52
general,教思政厅函〔2019〕7号,教育部,教育部办公厅关于开展2019年“4・15”全民国家安全教育日活动的通知,1,261,?,?,保卫处,?,2019-03-20,17:43
general,陕教通报[2019]第3期,省教育厅,王建利、刘建林同志在2019年全省高校教育教学工作会议上的讲话,1,259,?,?,教务处,?,2019-03-20,16:26
general,教育部通报第9期,教育部,陈宝生、吴道槐同志在2019年教育系统全面从严治党工作视频会议上的讲话,1,256,?,?,纪委办公室,?,2019-03-20,14:10
general,?,教育部,教育舆情周报（2019年3月11日至3月17日）,2,44,?,?,宣传部,?,2019-03-20,09:24
general,?,省委,胡和平书记对《关于“中国西部海外博士后创新示范中心”情况的报告》的批示,0,236,?,?,人力资源部,?,2019-03-19,18:17
general,?,省委,陕西工作交流第3-5期,0,234,?,?,校长办公室,?,2019-03-19,17:21
general,?,天津市政府,邀请函（第三届世界智能大会）,4,124,2019-05-15,?,科研院,?,2019-03-19,17:22
